{
  "asset_id": "sparkle_7007",
  "image": "sparkle_7007.png",
  "frame_size": [
    32,
    32
  ],
  "frames": 6,
  "fps": 10,
  "loop": true,
  "blend": "additive",
  "anchor": "center",
  "category": "magic",
  "tags": [
    "sparkle",
    "magic",
    "ambient"
  ],
  "generated": {
    "timestamp": "2026-06-06T16:31:12.023856",
    "generator": "MockGenerator-v1",
    "prompt": "small twinkling stars and dust particles",
    "seed": 7007,
    "model": "vfx_generator"
  }
}