{
  "asset_id": "pencil_storm",
  "image": "pencil_storm.png",
  "frame_size": [
    96,
    96
  ],
  "frames": 8,
  "fps": 12,
  "loop": false,
  "blend": "additive",
  "anchor": "center",
  "category": "combat",
  "tags": [
    "pencil_storm",
    "vfx"
  ],
  "generated": {
    "timestamp": "2026-06-07T09:22:18.795273",
    "generator": "gemini/sprite-sheet-v2",
    "prompt": "漫天的铅笔从画面右上方向左下方砸击，铅笔笔尖朝下，深黄色木杆+黑色笔尖+粉色橡皮擦头，运动模糊+撞击溅起木屑火花",
    "seed": 7777,
    "model": "gemini-3.1-flash-image-preview"
  }
}