{
  "asset_id": "lightning_4084",
  "image": "lightning_4084.png",
  "frame_size": [
    64,
    64
  ],
  "frames": 8,
  "fps": 12,
  "loop": false,
  "blend": "normal",
  "anchor": "center",
  "category": "combat",
  "tags": [
    "lightning",
    "vfx"
  ],
  "generated": {
    "timestamp": "2026-06-06T18:59:05.958416",
    "generator": "MockGenerator-v1",
    "prompt": "闪电链",
    "seed": 4084,
    "model": "vfx_generator"
  }
}