{
  "asset_id": "explosion_ice_7607",
  "image": "explosion_ice_7607.png",
  "frame_size": [
    64,
    64
  ],
  "frames": 8,
  "fps": 12,
  "loop": false,
  "blend": "additive",
  "anchor": "center",
  "category": "combat",
  "tags": [
    "explosion_ice",
    "vfx"
  ],
  "generated": {
    "timestamp": "2026-06-06T18:59:05.973992",
    "generator": "MockGenerator-v1",
    "prompt": "冰锥爆炸特效",
    "seed": 7607,
    "model": "vfx_generator"
  }
}