{
  "asset_id": "fireball_explosion_6427",
  "image": "fireball_explosion_6427.png",
  "frame_size": [
    64,
    64
  ],
  "frames": 8,
  "fps": 12,
  "loop": false,
  "blend": "additive",
  "anchor": "center",
  "category": "combat",
  "tags": [
    "fireball_explosion",
    "vfx"
  ],
  "generated": {
    "timestamp": "2026-06-06T18:59:05.949861",
    "generator": "MockGenerator-v1",
    "prompt": "火球术爆炸特效",
    "seed": 6427,
    "model": "vfx_generator"
  }
}