{
  "asset_id": "white_ice_0022",
  "image": "white_ice_0022.png",
  "frame_size": [
    64,
    64
  ],
  "frames": 8,
  "fps": 12,
  "loop": false,
  "blend": "additive",
  "anchor": "center",
  "category": "combat",
  "tags": [
    "white_ice",
    "vfx"
  ],
  "generated": {
    "timestamp": "2026-06-06T20:03:33.489608",
    "generator": "gemini/gemini-3.1-flash-image-preview",
    "prompt": "漫天的冰锥从右上方向左下方砸击，蓝白色冰晶碎片飞溅，魔法寒冰特效",
    "seed": 22,
    "model": "vfx_generator"
  }
}