{
  "asset_id": "heal_7181",
  "image": "heal_7181.png",
  "frame_size": [
    64,
    64
  ],
  "frames": 8,
  "fps": 12,
  "loop": false,
  "blend": "additive",
  "anchor": "center",
  "category": "magic",
  "tags": [
    "heal",
    "vfx"
  ],
  "generated": {
    "timestamp": "2026-06-06T18:59:05.965168",
    "generator": "MockGenerator-v1",
    "prompt": "治疗光环特效",
    "seed": 7181,
    "model": "vfx_generator"
  }
}